quotes,
What we call reality is in fact nothing more than a culturally sanctioned and linguistically reinforced hallucination.,
Notice that the whole story of Eden is the story of the struggle over a woman's relationship to a psychoactive plant.,
"Nature loves courage. You make the commitment and nature will respond to that commitment by removing impossible obstacles. Dream the impossible dream and the world will not grind you under, it will lift you up. This is the trick. This is what all these teachers and philosophers who really counted, who really touched the alchemical gold, this is what they understood. This is the shamanic dance in the waterfall. This is how magic is done. By hurling yourself into the abyss and discovering its a feather bed.",
"You are a divine being. You matter, you count. You come from realms of unimaginable power and light, and you will return to those realms.",
Psychedelics are illegal not because a loving government is concerned that you may jump out of a third story window. Psychedelics are illegal because they dissolve opinion structures and culturally laid down models of behaviour and information processing. They open you up to the possibility that everything you know is wrong.,
"Knowledge, or verbal facility, is no proof that you know what you're talking about.",
The Imagination is the golden pathway to everywhere.,
"This is the message of your life and my life - it’s that nothing lasts. Heraclitus said it: Panta Rhei. All flows, nothing lasts. Not your enemies, not your fortune, not who you sleep with at night, not the books, not the house in Saint-Tropez, not even the children - nothing lasts. To the degree that you avert your gaze from this truth, you build the potential for pain into your life. Everything is this act of embracing the present moment, the felt presence of experience, and then moving on to the next felt moment of experience. It’s literally psychological nomadism is what it is.",
The most beautiful things in the universe are inside the human mind.,
"Capitalism is going to deal itself out of existence, but before it does that, you're gonna pay $50 for a latte, because inflation is going impoverish all of us before people get pissed off enough to realize that all of the last hundred years of economic progress was actually a shell game to create billionaires, while the great masses of people saw their standard of living eroded and destroyed.",
"Every click of the cosmic clock 
 brings us closer to the process 
 for which the planet called us into existence.",
"If you don't have a plan, you become part of somebody else's plan.",
"The real secret of magic is that the world is made of words, and that if you know the words that the world is made of you can make of it whatever you wish.",
"We are told No, you're unimportant, you're peripheral - get a degree, get a job, get a this, get that, and then you're a player. You don't even want to play that game. You want to reclaim your mind and get it out of the hands of the cultural engineers who want to turn you into a half-baked moron consuming all this trash that's being manufactured out of the bones of a dying world.",
"The cost of sanity in this society, is a certain level﻿ of alienation",
There is no liberation to compare with freeing oneself from the illusions and delusions of the age in which one lives.,
Our ability to destroy ourselves is the mirror image of our ability to save ourselves.,
"For all we know, we know nothing.",
The drugs of the future will be computers. The computers of the future will be drugs.,
"The major adventure is to claim your authentic, true being, which is not culturally given to you. The culture will not explain to you how to be a real human being. It will tell you how to be banker, politician, Indian chief, masseuses, actress, whatever, but it will not give you true being.",
Culture is a plot against the expansion of consciousness.,
I don't believe consciousness is generated in the brain any more than television programs are made inside my TV. The box is too small.,
Astonishment is the proper response to reality.,
Behind us: the unknown. Before us: the secret.,
"What we call imagination is actually the universal library of what's real. You couldn’t imagine it if it weren’t real somewhere, sometime.",
Science does not deal with subjective experience... Well that's too bad because that is all any of us ever have.,
"We are led by the least among us - the least intelligent, the least noble, the least visionary. We are led by the least among us and we do not fight back against the dehumanizing values that are handed down as control icons.",
"You are not naked when you take off your clothes. You still wear your religious assumptions, your prejudices, your fears, your illusions, your delusions. When you shed the cultural operating system, then essentially you stand naked before the inspection of your own psyche.",
"My technique is don’t believe anything. If you believe in something, you are automatically precluded from believing its opposite.",
"What civilization is, is 6 billion people trying to make themselves happy by standing on each other's shoulders and kicking each other's teeth in. It's not a pleasant situation.",
We don't have to look far for miracles because they're all around us. Everything is astonishing. The universe on it's surface is alive with mystery.,
"Nothing comes unannounced, but many can miss the announcement. So it's very important to actually listen to your own intuition rather than driving through it.",
We do not birth our children into the world of nature. We birth our children into the world of culture.,
"The world which we perceive is a tiny fraction of the world which we can perceive, which is a tiny fraction of the perceivable world.",
"For talking monkeys to speak of truth is hubris of the highest degree. Where is it writ large that talking monkeys should be able to model the cosmos? If a sea urchin or a racoon were to propose to you that it had a viable truth about the universe, the absurdity of that assertion would be self-evident, but in our case we make an exception.",
"If the words 'life, liberty, and the pursuit of happiness' don't include the right to experiment with your own consciousness, then the Declaration of Independence isn't worth the hemp it was written on.",
"The problem is not to find the answer, it's to face the answer",
"I think ideology is toxic, all ideology. It's not that there are good ones and bad ones. All ideology is toxic, because ideology is a kind of insult to the gift of human free thinking.",
"As the bonfires of knowledge grow brighter, the more the darkness is revealed to our startled eyes.",
"The truth for sure, 
 when it arrives, 
 will make you smile. 
 If it doesn't, 
 you should seek 
 a deeper truth.",
"The tension in the world is the tension between the ego and the feminine, not between the masculine and the feminine.",
"Nature is not mute, it is a man who is deaf.",
"Ego is a structure that is erected by a neurotic individual who is a member of a neurotic culture against the facts of the matter. And culture, which we put on like an overcoat, is the collectivized consensus about what sort of neurotic behaviors are acceptable.",
"Think about our dilemma on this planet. If the expansion of consciousness does not loom large in the human future, what kind of future is it going to be?",
"The only real experience that counts, is your own.",
"We are caught inside a mystery, veiled in an enigma, locked inside a riddle",
"Claim your place in the sun and go forward into the light. The tools are there; the path is known; you simply have to turn your back on a culture that has gone sterile and dead, and get with the programme of a living world and a re-empowerment of the imagination.",
"Culture is a perversion. It fetishizes objects, creates consumer mania, it preaches endless forms of false happiness, endless forms of false understanding in the form of squirrelly religions and silly cults. It invites people to diminish themselves and dehumanize themselves by behaving like machines.",
Worrying is betting against yourself.,
"Belief is a toxic and dangerous attitude toward reality. After all, if it's there it doesn't require your belief- and if it's not there why should you believe in it?",
The main thing to understand is that we are imprisoned in some kind of work of art.,
Western civilization is a loaded gun pointed at the head of this planet.,
"The bigger you build the bonfire, the more darkness is revealed.",
"Television is by nature the dominator drug par excellence. Control of content, uniformity of content, repeatability of content make it inevitably a tool of coersion, brainwashing, and manipulation.",
Human beings are co-partners with deity in the project of being. This is the basis of all magic.,
Anything which must be understood by millions of people is so hopelessly divorced from how it is that it becomes a form of fiction.,
How can we know who is the other until we know who is the self?,
Life must be a preparation for the transition to another dimension.,
"I’ll try to be around and about. But if I’m not, then you know that I’m behind your eyelids, and I’ll meet you there",
We are so much the victims of abstraction that with the Earth in flames we can barely rouse ourselves to wander across the room and look at the thermostat.,
"Life lived in the absence of the psychedelic experience upon which primordial shamanism is based is life trivialized, life denied, life enslaved to the ego.",
We are going through the eye of the needle,make sure you leave what you don't need behind
"You see, a secret is not something untold. It’s something which can’t be told.",
"Nature is not our enemy, to be raped and conquered. Nature
 is ourselves, to be cherished and explored. Shamanism has always known this,
 and shamanism has always, in its most authentic expressions, taught that the
 path required allies. These allies are the hallucinogenic plants and the
 mysterious teaching entities, luminous and transcendental, that reside in that
 nearby dimension of ecstatic beauty and understanding that we have denied until
 it is now nearly too late.",
"If the ego is not regularly and repeatedly dissolved in the unbounded hyperspace of the Transcendent Other, there will always be slow drift away from the sense of self as part of nature’s larger whole. The ultimate consequence of this drift is the fatal ennui that now permeates Western Civilization.",
"If we could feel what we are doing to the Earth, we would stop immediately.",
"Psychedelics can carry you farther and faster than most people care to go. Once you get to psychedelics, it's no longer a matter of seeking the answer, you have found the answer. Now the issue changes dramatically, you must face the answer.",
We live in condensations of our imagination,
No one knows enough to worry.,
Being imposes some kind of obligation to find out what's going on.,
"There’s light at the end of the tunnel. The problem is that tunnel is in the back of your mind. And if you don’t go to the back side of your mind you will never see the light at the end of the tunnel. And once you see it, then the task becomes to empower it in yourself and other people. Spread it as a reality. God did not retire to the seventh heaven, God is some kind of lost continent IN the human mind.",
"There is a spiritual obligation, there is a task to be done. It is not, however, something as simple as following a set of somebody else's rules",
"You have to take seriously the notion that understanding the universe is your responsibility, because the only understanding of the universe that will be useful to you is your own understanding.",
"Chaos is what we've lost touch with. This is why it is given a bad name. It is feared by the dominant archetype of our world, which is Ego, which clenches because its existence is defined in terms of control.",
One thing that these Buddhists have certainly gotten right is that attention to attention is the key to taking control of your mental life.,
"The artist’s task is to save the soul of mankind; and anything less is a dithering while Rome burns. Because of the artists, who are self-selected, for being able to journey into the Other, if the artists cannot find the way, then the way cannot be found.",
"And what is the primary datum? It's the felt presence of immediate experience. In other words, being here now is the primary datum.",
"We've painted ourselves into a corner where the only choice is real nightmare - triage, epidemic disease, famine, fascism, the collapse of human rights - or a leap to an entirely different level. We've taken business-as-usual off the menu. Now only the extreme possibilities loom.",
"This is what they have suppressed so long. This is why they are so afraid of the psychedelics, because they understand that once you touch the inner core of your own and someone else's being you can't be led into thing-fetishes and consumerism. The message of psychedelics is that culture can be re-engineered as a set of emotional values rather than products. This is terrifying news.",
"DMT is a reliable method for crossing in to a dimension that human beings have debated the existence of for 50.000 years. Is there an invisible nearby world inhabited by active intelligences with which human beings can communicate? You bet. And if you don't think so, then tell me you don't think so after you've smoked 75mg DMT. Otherwise we just don't have anything to talk about.",
"You are some kind of a mystery suspended between two eternities. And in that moment, when a mind looks out at a world and asks the question, ‘What is it?’ In that moment art can be created.",
We are the inheritors of a million years of striving for the unspeakable.,
"You are an explorer, and you represent our species, and the greatest good you can do is to bring back a new idea, because our world is endangered by the absence of good ideas. Our world is in crisis because of the absence of consciousness.",
"Don't worry. You don't know enough to worry. . . . Who do you think you are that you should worry, for cryin' out loud. It's a total waste of time. It presupposes such a knowledge of the situation that it is, in fact, a form of hubris.",
"I think the real test of psychedelics is what you do with them when you're not on them, what kind of culture you build, what kind of art, what kind of technologies... What's lacking in the Western mind is the sense of connectivity and relatedness to the rest of life, the atmosphere, the ecosystem, the past, our children's future. If we were feeling those things we would not be practicing culture as we are.",
"To my mind this makes psychedelics central to any political reconstruction, because these are the only force in nature that actually dissolve linguistics structures; lets the mechanics of syntax to be visible, allows the possibility for rapid introduction and spread of new concepts; gives permission for new ways of seeing; and this is what we have to do, we have to change our minds.",
"The overriding problems are brought on by the existence of the ego, a maladaptive behavioral complex in the psyche that gets going like a tumor. If it's not treated - if there's not pharmacological intervention - it becomes the dominant constellation of the personality.",
"Your memories are eroding away. The futures you anticipate, will mostly not come to pass, and the real richness is in the moment. And it's not necessarily some kind of 'Be Here Now' feel-good thing because it doesn't always feel good. But it always feels. It is a domain of feeling. It's primary.",
When we free ourselves we are not freed into a void. When we free ourselves we are freed into a dimension in which Art is an obligation.,
You're immortal as long as you live.,
"To contact the cosmic giggle, to have the flow of casuistry begin to give off synchronistic ripples, whitecaps in the billows of the coincidental ether, if you will. To achieve that, a precondition is a kind of unconsciousness, a kind of drifting, a certain taking-your-eye-off-the-ball, a certain assumptions that things are simpler than they are, almost always precedes what Mircea Eliade called ‘the rupture of plane’ that indicates that there is an archetypal world, an archetypal power behind profane appearances.",
To me it begins and ends with these psychedelic substances. The synergy of the psilocybin in the hominid diet brought us out of the animal mind and into the world of articulated speech and imagination.,
"Apparently there is a great discovery or insight which our culture is deliberately designed to suppress, distort, and ignore. That is that nature is some kind of minded entity. That nature is not simply the random flight of atoms through electromagnetic fields. Nature is not the empty, despiritualized , lumpen matter that we inherit from modern physics. But it is instead a kind of intelligence, a kind of mind.",
"If you actually look at the etymology of the word 'hallucination', what it's come to mean in English is a delusion. But what it really means in the original language is to wander in the mind. That's the meaning of 'hallucination', to wander in the mind.",
How do we fight back? By creating art.,
"The world is not made of anti-mu mesons, quarks, and photons, and electromagnetic fields. Reality is made of words.",
Every step into freedom contains within it the potential for greater bondage.,
There is no knowledge without risk taking.,
Cultures are virtual realities made of language.,
"We are alienated, so alienated that the self must disguise itself as an extraterrestrial in order not to alarm us with the truly bizarre dimensions that it encompasses.",
"We have to recognize that the world is not something sculptured and finished, which we as perceivers walk through like patrons in a museum; the world is something we make through the act of perception.",
"This is what I believe: That we are not pushed from behind by the casual unfolding of historical necessity, but that we are in the grip of an attractor of some sort, which lies ahead of us in time.",
Our world is in crisis because of the absence of consciousness,
"So you know what we have to do is stop looking for leadership from the top, because the least among us make their way into those positions of power... So what we have to do is knock off this fantasy of being citizens inside a democratic state, I mean, what we are, are the propagandized masses inside a fascist dictatorship.",
"I really think there is a very large distinction between synthetic and naturally occurring drugs. ... I think that these plants 'take people' as much as people take the plants. ... When you take one of these ancient, ancient hallucinogens you are locking in to the morphogenetic fields of all the people who ever took it.",
"Language betrays, 
 in order to mean.",
"I don’t know what life is like without cannabis, I hear there is such a thing.",
We are part of a symbiotic relationship with something which disguises itself as an extra-terrestrial invasion so as not to alarm us.,
Who is to say what is real and what is not?'Real' is a distinction of a naïve mind.,
Nobody is smarter than you are. And what if they are? What good is their understanding doing you?,
"We have been to the moon, we have charted the depths of the ocean and the heart of the atom, but we have a fear of looking inward to ourselves because we sense that is where all the contradictions flow together.",
The long night of human history is drawing at last to its conclusion.,
"What is needed is a spirit of boundary dissolution, between individuals, between classes, sexual orientations, rich and poor, man and woman, intellectual and feeling toned types. If this can happen, then we will make a new world. And if this doesn't happen, nature is fairly pitiless and has a place for us in the shale of this planet, where so many have preceded us.",
Biology seems to be a chemical strategy for amplifying quantum mechanical indeterminacy so that it leaves the subatomic realm and can be present in a hundred and forty five pound block of meat.,
The surface of things is not where attention should rest.,
Alcoholism isn't a disease. It's a failure of self-image.,
"So what needs to be done is to spread the idea that anxiety is inappropriate. It's sort of like we who are psychedelic have to function as sitters for society, because society is going to thrash, and resist, and think it's dying, and be deluded, and regurgitate unconscious material, and so forth and so on. And the role then, I think, for psychedelic people is to try and spread calm.",
All time is is how much change you can pack into a second.,
"The psychedelic inner astronaut sees things which no human 
 being has ever seen before, and no other human being will ever see again. But in fact this has no meaning unless it is possible to carry it back into the collectivity.",
We can will the perfect future into being by becoming microcosms of the perfect future.,
"What blinds us, or what makes historical progress very difficult, is our lack of awareness of our ignorance.",
Cyberspace is the human transition into a mathematical super space where we as a collectivity become optionally a single point of view.,
"I believe in extraterrestrials, but I believe that real extraterrestrials are so peculiar that the job is to recognize them.",
I think that a lot of people are making a lot of money spreading anxiety. Anxiety sells.,
"Beauty is self-defined, perceived and understood without ambiguity. It's the stuff that lies under the skins of our individual existences.",
Half the time you think your thinking you’re actually listening,
It's a product of the fractal laws that govern the world at an informational level. There is no deeper truth.,
"Psychedelics are not flashlights into the chaos of the Freudian unconscious, they are tools for mathematically unpacking your mind into a higher dimensional space. In the Newtonian and print created space that we are walking around in you, are like a self extracting archive, that hasn't self extracted itself yet.",
"The Internet is light at the end of the tunnel. I don't care if it's being used to peddle pornography, I don't care if it's being trivialized in a thousand ways. Anything can be trivialized. The important point is that it is leveling the playing field of global society. It is creating de-facto an entirely new set of political realities. None of the constipated, oligarchic structures that are resisting this were ever asked. Their greed betrayed them into investing in this in the first place without ever fully grasping what the implications of it were for their larger agenda.",
"In shamanism and certain yogas, Taoist yoga, claim very clearly that the purpose is to familiarize yourself with this after-death body, in life, and then the act of dying will not create confusion in the psyche. You will recognize what is happening. You will know what to do. And you will make the clean break.",
"The smart people who are straight are involved in simply the media management of what has turned into a slow apocalypse, spreading starvation, exacerbated class differences, toxified agriculture, so forth and so on. I don't believe the Establishment thinks there are solutions. Their policy is basically the management of panic, which is hardly a forward moving approach to the adventure of human civilization.",
"What they [psychedelics] cause is what I'm advocating, a fundamental revaluation of cultural values, because culture as we're practicing it currently is causing a lot of pain to a lot of people, and animals, and ecosystems, none of whom were ever allowed to vote on whether they wanted this process to go in this direction.",
"We cannot evolve faster than our language. The edge of being is the edge of meaning, and somehow we have to push the edge of meaning. We have to extend it.",
"Our medium is meat, but we are made of information.",
The shaman is a person who is able to transcend the dimensional confines of cultural existence. They know more than the people they serve. The people they serve are like children within the game of culture. Only the shaman knows that culture is a game. Everyone else takes it seriously. That's how he can do his magic.,
The history of man that you don't know is what your unconscious is made out of.,
"The drug may not be toxic, but you may be self-toxic, and you may discover this in the drug experience.",
I believe that the place to search for extraterrestrials is in the psychic dimension.,
It's no big deal about how you get language to evolve. You cause language to evolve by saying new and intelligent things to each other.,
"Nature loves courage. You make the commitment and nature will respond to that commitment by removing impossible obstacles. Dream the impossible dream and the world will not grind you under, it will lift you up.",
"I often like to think that our map of the world is wrong, that where we have centered physics, we should actually place literature as the central metaphor that we want to work out from. Because I think literature occupies the same relationship to life that life occupies to death. A book is life with one dimension pulled out of it. And life is something that lacks a dimension which death will give it. I imagine death to be a kind of release into the imagination in the sense that for characters in a book, what we experience is an unimaginable dimension of freedom.",
