quotes,
"We want freedom. We want freedom from the constraints of the cycles of the sun and the moon. We want freedom from drought and weather, freedom from the movement of game, the growth of plants, freedom from control from mendacious popes and kings, freedom from ideology, freedom from want. This idea of freeing ourselves has become the compass of the human journey.",
"What blinds us, or makes historical progress very difficult, is our lack of awareness that our beliefs have grown obsolete and should be put aside.... This is I think much of the problem of the modern dilemma: Direct experience has been discounted, and in its place all kinds of belief systems have been erected.... If you believe something, you are automatically precluded from believing its opposite; which means that a degree of your human freedom has been forfeited in the act of committing yourself to this belief.",
"I think that what these psychedelics do, is they actually do connect you to the whole circle. You stand outside of the moment from which you embarked on your psychedelic experience, and you see eternity like a vast landscape deployed in front of you. So what I think psychedelics are is they're about time, and they somehow make all time co-present.",
The word 'self' is as great a mystery as the word 'other'. It's just a polarity between two mysteries.,
A singularity is a place where the rules are broken. A miracle is a singularity.,
"You put two egos together and you've either got a conflict, which is always interesting, or better yet, a love affair.",
"Our culture takes us out of the body and sells our loyalty into political systems, into religions, into inanimate objects and machines, collections, so forth and so on. The felt experience of the body is what the psychedelics are handing back to us.",
"...the mind is more powerful than any imaginable particle accelerator, more sensitive than any radio receiver or the largest optical telescope, more complete in its grasp of information than any computer: the human body- its organs, its voice, its powers of locomotion, and its imagination- is a more-than-sufficient means for the exploration of any place, time or energy level in the universe.",
There is nobody who is so enlightened that they don't need to work on themselves.,
"Our destiny is to become what we think, to have our thoughts become our bodies and our bodies become our thoughts.",
"It is true that when you smoke DMT, for example, at a sufficiently high and prepared dose, you get elves, everybody does. All you need do, is inhale deeply three times, and you know... You want contact? You want elves? You want alien contact? You'll have that!",
Our world is endangered by the absence of good ideas,
"The only difference between a drug and a computer is that one is slightly too large to swallow. ... And our best people are working on that problem, even as we speak.",
The apocalypse is not something which is coming. The apocalypse has arrived in major portions of the planet and it’s only because we live within a bubble of incredible privilege and social insulation that we still have the luxury of anticipating the apocalypse.,
"We are, in fact, hyper-dimentional objects of some sort which cast a shadow into matter, and the shadow in matter is the body. And at death, what happens basically, is that the shadow withdraws, or the thing which cast the shadow withdraws, and metabolism ceases, and matter which had been organized into a dissipative structure in a very localized area, sustaining itself against entropy by cycling material in and degrading it and expelling it, that whole phenomenon ceases, but the thing which ordered it is not affected by that.",
"There is a sort of fair play, and if you can get in touch with that in your life, if you can have that perception, the world will begin to work for you, it will begin to move toward you... Nature loves courage, and it shows you that loves courage because it will remove obstacles.",
"We have changed. We are no longer, as I said, bipedal monkeys. We are instead a kind of cybernetic coral reef of organic components and inorganic technological components.",
"There is an angel within the monkey struggling to get free, and this is what the historical crisis is all about.",
You aren't an object. You're a process of some sort.,
"Psychedelic drugs, especially psilocybin, allow a searchlight to be thrown on these deeper levels of the psyche, as Jung correctly stated. But it is not a museum of archetypes or psychic constructs, as he seemed to assume. It is a frontier of wholeness into which any person, so motivated and so courageous as to wish to do it, can go and leave the mundane plane far behind.",
If we were to place our power at the service of our imaginations rather than our primate politics we would create a civilization worthy of the name.,
The imagination is a dimension of nonlocal information,
"What the churches are peddling is high abstraction, and you really have to work yourself up into a lather to be able to accept that as worthy of that kind of attention. The psychedelic subset of society is into an experience, and it's accessible.",
"The psychedelic mind is a higher dimensional mind, it is not fit for three dimensional space time.",
"You are the cutting edge of a thirteen billion year old process of defining novelty. Your acts matter. Your thoughts matter. Your purpose? To add to the complexity. Your enemy? Disorder, entropy, stupidity, and tastelessness.",
Thinkers are not a welcome addition to most social situations.,
"We can no longer have forbidden areas of the human mind, or cultural machinery. We have taken upon ourselves the acquisition of so much power that we now must understand what we are. We cannot travel much further with the definitions of man that we inherit from the Judeo-Christian tradition. We need to truly explore the problem of consciousness.",
"Patanjali specifically says that there are three paths to the goal of yoga. And they are, control of the breath, control of posture, and light-filled herbs. It says it right there. Stanza 6 of the Yoga Sutras of Patanjali.",
It's meanings that we need to coax into our lives.,
"‎The way you understand and investigate time is by moving inward, into metabolism. The human body is a knot in time.",
The engineers of the future will be poets.,
Only psychos and shamans create their own reality,
"We are somehow the children of the planet, we are somehow its finest hour; we bind time, we bind the past, we anticipate the future - we are going hyper-spatial; we are claiming a whole new dimension for biology that it never claimed before. We are actually becoming a fourth-dimensional kind of creature. Our future is somehow with us, as we seem to be able to move through metamorphosis into our own imaginations - a super civilization spread throughout space and time. Our future is a mystery, our destiny is to live in the imagination.",
The culture cannot evolve faster than the language. The language is the flashlight that shows the path.,
"Everything will come true in cyberspace. That's the whole idea. What cyberspace is, on one level, it's simply the human imagination vivified, hardwired.",
"Science is the exploration of the experience of nature without psychedelics. And I propose, therefore, to expand that enterprise and say that we need a science beyond science. We need a science which plays with a full deck.",
"Capitalism is not a human being. Capitalism is a Moloch, a god, a god of bloody sacrifice that sees human beings as ants",
This is the nature of going forward into being: A series of self-transforming ascents of level.,
No one yet understands the mysterious intelligence within plants or the implications of the idea that nature communicates in a basic chemical language that is unconscious but profound. We do not yet understand how hallucinogens transform the message in the unconscious into revelations beheld by the conscious mind.,
"It is not easy to measure the ocean, but we can be measured by it, confront it, and be in it.",
Ninety percent of the difficulty in your intellectual life would never have happened if you just had better taste.,
The future holds no terrors for a person who knows how process inevitably unfolds. They are always right and with it each moment.,
Culture is a simplification and a lie. It's the currency by which fools navigate the world. Smart people get beyond it.,
Once you have the psychedelic tool in hand then some real choices have to be made.,
"Drugs are about dulling perception, about addiction and about behavioral repetition...What *psychedelics* are about is pattern- dissolving experiences of an extraordinarily high or different awareness. They are the exact opposite of drugs. They promote questioning , they promote consciousness, they promote value examinations, they promote the reconstruction of behavioral patterns.",
"The Logos is a voice heard, in the head. And the Logos was the hand on the rudder of human civilization for centuries, up until, in fact, the collapse of the ancient mystery religions and the ascendancy of Christianity to the status of a world religion.",
No culture on earth is as heavily narcotized as the industrial West in terms of being inured to the consequences of maladaptive behavior. We pursue a business-as-usual attitude in a surreal atmosphere of mounting crises and irreconcilable contradictions.,
Mind conjures miracles out of time.,
"You know what, I'm stoned, and I'm proud.",
We have wandered into a state of prolonged neurosis because of the absence of a direct pipeline to the unconscious and we have then fallen victim to priestcraft of every conceivable sort.,
"I really think that the psychedelic realm is the realm of ideas, and that ideas which change the world come first from that place.",
"The question is being asked, 'Are we alone?'  And though we now focus on that question we need to think beyond that to what if we're not alone? Then what becomes the next imperative question?",
"Television, introduced at the close of World War II, has become a form of electronic heroin, and it isn't even your trip. They don't even let you go on your own trip, you get a trip designed by Madison Avenue.",
"To me, the psychedelic experience is the experience of trying to make sense of reality.",
It seems to me far more likely that an advanced civilization would communicate inter dimensionally and telepathically.,
What was created by the era of the proper gentleman was excellent table manners and genocide over most of the surface of the planet.,
Ecstasy is not simply joy. Ecstasy is an emotion of great complexity that hovers almost on the edge of terror sometimes.,
"The reason I am so passionately committed to the psychedelic thing is because I see it as radical, and if this is not the moment for radical solutions, what is?",
Consistency is the hobgoblin of small minds.,
"A hallucination is a species of reality, as capable of teaching you as a videotape about Kilimanjaro or anything else that falls through your life.",
"Liberate yourself from the illusion of culture. 
Take responsibility for what you think and what you do.",
"Wherever we press beyond the thin curtain of rationalist culture, we discover the incredibly rich, erotic, scary, promising presence of this intelligent Other, that beckons us out of history, and says, you know: 'The galaxy lies waiting.'",
"The pro-psychedelic plant position is clearly an antidrugs position. Drug dependencies are the result of habitual, unexamined, and obsessive behavior; these are precisely the tendencies in our psychological makup that the psychedelics mitigate. The plant hallucinogens dissolve habits and hold motivations up to inspection by a wider, less egocentric, and more grounded point of view within the individual.",
"It's clearly a crisis of two things: of consciousness and conditioning. We have the technological power, the engineering skills to save our planet, to cure disease, to feed the hungry, to end war; But we lack the intellectual vision, the ability to change our minds. We must decondition ourselves from 10,000 years of bad behavior. And, it's not easy.",
"We tend to disempower ourselves. We tend to believe that we don’t matter. And in the act of taking that idea to ourselves we give everything away to somebody else, to something else.",
"By passing into the psychedelic phase, the space-faring phase, the entire species is passing into adolescence.",
What I think is going on is that probably language was entertainment long before it was meaning. It's a kind of tuneless singing.,
"Not to know one's true identity is to be a mad, disensouled thing — a golem. And, indeed, this image, sick-eningly Orwellian, applies to the mass of human beings now living in the high-tech industrial democracies. Their authenticity lies in their ability to obey and follow mass style changes that are conveyed through the media. Immersed in junk food, trash media, and cryp-tofascist politics, they are condemned to toxic lives of low awareness. Sedated by the prescripted daily television fix, they are a living dead, lost to all but the act of consuming.",
"In a sense, what's happening is that the unconscious mind is a luxury the human species cannot afford at this point in our dilemma, and so the unconscious mind is simply rising into consciousness by being hardwired into this global infrastructure.",
"The psychedelic experience is simply a compressed instance of what we call understanding, so that living psychedelically is trying to live in an atmosphere of continuous unfolding of understanding, so that every day you know more and see into things with greater depth than you did before. This is a process of education.",
Psychedelic experiences and dreams are chemical cousins,they are only different in degree.
I think that's the job of each of us - to show our best toys and our best tricks that lift us and our friends to higher and higher levels. There is no end to this bootstrapping process. The future of the human mind and body and the future of humans together is endlessly bright.,
"I think institutions will inevitably substitute a rite or a ritual for the authentic, for the real McCoy, because then priests can control the pipeline to god, and the parishioner can approach with offerings. But if everybody can have a pipeline to deity, why then the whole priest scam is put out of business.",
"Sometime in the last 50,000 years, before 12,000 years ago, a kind of paradise came into existence. A situation in which men and women, parents and children, people and animals, human institutions and the land all were in dynamic balance and not in any primitive sense at all. Language was fully developed, poetry may have been at its climax, dance, magic, poetics, altruism, philosophy. There's no reason to think that these things were not practiced as adroitly as we practice them today and it was under the boundary dissolving influence of psilocybin.",
The psychedelic issue is a civil rights and civil liberties issue. It is an issue concerned with the most basic of human freedoms: religious practice and the privacy of the individual mind.,
"What happens with DMT is you leap over all the barriers in the first few seconds. Unlike mushrooms where over hours and hours on a high dose you might navigate yourself to the center of the mandala, DMT is like being struck by metaphysical lightening.",
"The leading edge of reality is mind, and mind is the primary substratum of being.",
"What is happening, I think, it's really bigger than psychedelics, it's bigger than human evolution. We are not making the waves in this ocean. We are corks, riding the waves of the ocean. But we are privileged, by perhaps chance alone, to occupy a unique moment in the history of the universe. A moment when the universe goes through some kind of self-transforming, evolutionary, inflationary expansion. That's what's happening.",
"Culture is more and more consciously becoming a project carried out in the domain of language by, for instance, propaganda both governmental and commercial.",
I think what we have to do is convince people that matter is tacky.,
Nobody should be allowed more than fifty years to get their act together.,
Our theories are the weakest part of what we say. What we're working from is the fact of an experience which we need to make sense of.,
LSD is different. LSD is like psychoanalytical Drano. It's not a personality.,
I think the world is growing more psychedelic every day. I'm completely hopeful. . . . This is how it should be. This is what it's like when a species prepares to depart for hyperspace.,
We are consciousness. We may not always be monkeys.,
"The shaman is not merely a sick man, or a madman; he is a sick man who has healed himself.",
"I think it's the sheer power of the hallucinogens that puts people off. You either love them or you hate them, and that's because they dissolve world views. And if you like the experience of having your entire ontological structure disappear out from under you, if you think that's a thrill, you'll probably love psychedelics.",
"The way out then is personal responsibility, new operating systems downloaded from outside of culture, which means from the deeper wisdom of the psychedelic plants and then a commitment to community and a motto of ""To the future, without fear!"" Without fear!",
[DMT] raises all the questions in a hurry. It's so intense and so oriented toward the other and the visual and the hallucinogenic that it isn't really like a drug. It's more like an event that you ran into. You just came around a corner and there was the unspeakable.,
"It is now very clear that techniques of machine-human interfacing, pharmacology of the synthetic variety, all kinds of manipulative techniques, all kinds of data storage, imaging and retrieval techniques - all of this is coalescing toward the potential of a truly demonic or angelic kind of self-imaging of our culture... And the people who are on the demonic side are fully aware of this and hurrying full-tilt forward with their plans to capture everyone as a 100% believing consumer inside some kind of a beige furnished fascism that won't even raise a ripple.",
Animals are something invented by plants to move seeds around. An extremely yang solution to a peculiar problem which they faced.,
"Skywalker is a direct translation of the word shaman out of the Tungusic, which is where Siberian shamanism comes from. So these heroes that are being instilled in the heart of the culture are shamanic heroes. They control a force which is bigger than everybody and holds the galaxy together.",
The psychedelics are this immense tool for the inspection of our own nature.,
"The planet has a kind of intelligence, it can actually open a channel of communication with an individual human being. The message that nature sends is, transform your language through a synergy between electronic culture and the psychedelic imagination, a synergy between dance and idea, a synergy between understanding and intuition, and dissolve the boundaries that your culture has sanctioned between you, to become part of this Gaian supermind",
"In a way, this is a definition of shamanism. A shaman is a person who by some means has gotten out of their own culture.",
"The shaman is the figure at the beginning of human history that unites the doctor, the scientist and the artist into a single notion of care-giving and creativity.",
"The Truth doesn't need your cooperation to exist. All forms of cult, all forms of hype, all forms of delusion do require your participation in order to exist. I've looked into marginal areas of human experience -historical and otherwise- with a rational mind, and what I've found is that doorways into the miraculous are far fewer than the publicists of the New Age would have us believe. On the other hand, they are not as rare as the proponents of radical reductionism and materialism would have us believe. There are doorways out of the mundane.",
"DMT seems to argue, convincingly I might add, that the world is made entirely of something, for want of a better word, we would have to call magic.",
People have a right to get stoned. They have a right to think and explore their own minds. This is as intimate a part of their being as their sexuality. Any culture which mitigates that is clearly afraid of a full and fair and open dialogue about what reality is and what real human values ought to be.,
"We're not going to save the monkey unless we can shed the monkey. And the greatest impetus, the greatest inspiration to the expression of our higher selves comes in the confrontation with psyche that occurs in the psychedelic experience.",
I'm not an advocate for everything that rolls out of the laboratory. I'm an advocate for things sanctioned by millennia of usage.,
"We [psychonauts] are all going to go into the books as pioneers, because it's too early for us to be anything else. There's no map, no finished database, just anecdotes of the crazy, crazy stuff that goes on. That's why it's so important to try and share [our stories].",
"Cultivate an ongoing stream of self-description, telling yourself what is happening. Get used to the idea that mind can penetrate the immediate surface of being and reveal the tactile density of it as a manifold whose measure cannot be immediately taken by the eyes, that it's deep, it's connected, it's complex. Everything holds within itself the anticipation and the memory of everything else.",
"There is no mundane dimension really, if you have the eyes to see it, it is all transcendental.",
The obligation on us is to communicate the truth so that it is understood. The belief will take care of itself.,
"What WE represent is the nexus of concrescent novelty that has been moving itself together, complexifying itself, folding itself in upon itself for billions and billions of years. There is, so far as we know, nothing more advanced than what is sitting behind your eyes. The human neocortex is the most densely ramified complexified structure in the known universe.",
Our assumptions are the edges of our worlds.,
The movement of a single atom from one known position to another known position changes an experience from nothing to overwhelming. This means that mind and matter at the quantum mechanical level are all spun together.,
It is the people who are 'far out' who are gaining advantage in the evolutionary jostling for efficacious strategies.,
Time will perfect matter.,
"In 1948, television was introduced, and millions and millions of people lead larval, low-awareness, warehoused lives mainlining an electronic drug straight into their brains.",
The Gaian mind is what were calling the psychedelic experience. Its an experience of the living fact of the entelechy of the planet - and without that experience we wander in a desert of bogus ideologies. But with that experience the compass of the self can be set.,
"As I see it, Being, the Cosmos, whatever you want to call it, is a struggle between two implacable forces: Novelty on the one side and habit on the other side.",
"A long long time ago I took an oath to tell all secrets that came my way. Don't tell me a secret, I won't keep it. I'm against secrets, I'm against hierarchies, lineages, all assumption of special knowledge on the part of anyone in the presence of anyone else is abhorrent to me. I mean, I am a true anarchist first and foremost.",
The mind is the cutting edge of the evolving event system.,
"Once you get to this place on what we might metaphorically call your spiritual quest, once you get to the place where you hear about psychedelics, the issue is no longer then about where is the gas peddle on the spiritual vehicle. The issue suddenly becomes, where is the brake? Because this is the fuel to go where you want to go. This is the power to lift you where you want to be lifted.",
People are concrescences of ambiguity.,
"Reality is, you know, the tip of an iceberg of irrationality that we've managed to drag ourselves up onto for a few panting moments before we slip back into the sea of the unreal.",
I believe reality is a marvelous joke staged for my edification and amusement and everybody is working very hard to make me happy.,
Alchemy is really the secret tradition of the redemption of spirit from matter.,
History is rooted in the future,
"The Germans take quite a knock for the holocaust, but the Catholic church manages to push more people into death, disease, and degradation every year than the holocaust managed in its entire show. And it's thought rather crass to even mention the fact. It seems to me that as long as these Catholic bishops can show their face in public that we are in complicity with mass murder.",
"Part of what is wrong with our society, and hence with ourselves, is that we consume images, we don't produce them. We need to produce, not consume, media.",
"And what is shamanism but philosophy with a hands-on attitude. Philosophy not made around the camp fire, but philosophy based on the acquisition of extreme experience. That's how you figure out what the world is, not by bicycling around in the burbs, but by forcing extreme experience.",
There is no contradiction between technology and spirit. There is no contradiction between the search for intellectual integration and understanding and the psychedelic experience. There is no contradiction between ultra-advanced hyperspacial cyber culture and Paleolithic archaic culture. We have come to the end of our sojourn in matter. We have come to the end of our separateness.,
"I think the entire message of the psychedelic experience, which is basically the sine qua non of the rebirth of alchemical understanding, the very basis of that understanding is that nature seeks to communicate.",
