quotes,
Fine tuning the institutions built by powdered wig guys two hundred years ago is a long shot at holding the whole thing together.,
"It's my belief that one of the unconscious reasons which underlies the odd attitude of the establishment toward hallucinogens is the fact that they bring the mystery to the surface as an individual experience. In other words, you do not understand the psychedelic experience by getting a report from Time magazine or even the Economist. You only understand the psychedelic experience by having it.",
"To my mind this is what shamanic training must really be, is mnemonic training. If you want to bring the stuff back you have to train yourself to bring it back.",
There is not the Newtonian universe deployed throughout the parsecs and kiliocosms of physical space and the interior mental universe. They are the same thing.,
"It's as important to be well informed in this area, if you're going to do it, as it is to be well informed about procedures in skin diving and that sort of thing if you're going to do that.",
We are like coral animals embedded in a technological reef of extruded psychic objects...All our tool-making implies our belief in an ultimate tool.,
Ideologies are cultural memes. They are the most confining of the cultural memes. That's where culture gets real ugly. It is when you rub up against its ideologies.,
Time is a series of fluctuating variables.,
The sensory ratios that are being reinforced by the new electronic technology are like the sensory ratios that were in place fifteen thousand years ago. . . . Print imposes a condition on human mind which is now lifting.,
It's the impossible become possible and yet remaining impossible.,
Look at the reputation they gave him. [Giordano] Bruno without the pyre is a whiskey priest laying waste to the maids of Umbria.,
"I discovered early in life a stunning truth that's made my life very complicated in its wake, but that I still think is true, and it's that people are very easy to love.",
"National governments are under paid, under staffed, and under talented.",
"Apparently, in the Avesta classical period no one would have dreamed of having a spiritual experience without resort to drugs.",
"In a sense, sexuality is the built-in psychedelic experience that only a very few people manage to evade.",
"The psychedelic viewpoint is becoming more and more legitimate, but psychedelic drugs are not. That's the odd paradox of it.",
The central figure in the archaic revival is the shaman.,
The message of psychedelics is that culture can be re-engineered as a set of emotional and spiritual values rather than products. This is terrifying news.,
"Closure is a neurotic and infantile demand to make upon reality, other people, or language.",
"People are, in the confines of their own apartments, becoming Magellans of the interior world and reaching out to this alien thing and beginning to map it and bring back stories that can only be compared to the kind of stories that the chroniclers of the New World brought back to Spain at the close of the 15th century.",
"The possibility seems to be that what we call styles, or what we call motifs, are actually categories in the unconscious.",
"There is no dualism in the world of light. The conventions of relativity say that time slows down as one approaches the speed of light, but if one tries to imagine the point of view of a thing made of light, one must realize that what is never mentioned is that if one moves at the speed of light there is no time whatsoever... One exists in eternity, one has become eternal... One is then apart from the moving image; one exists in the completion of eternity.",
"The thing that is so powerful about the psychedelics is that they perform on demand, which almost in principle you cannot expect of a mystical experience because that would be essentially man ordering God at man's whim, which is not how it's supposed to work.",
Ultimate novelty must be a situation where all boundaries are dissolved.,
We get to the point then with modern science where you could almost say that modern science is the art of describing those systems so crude in their structure that they are not subject to temporal variables.,
"The psychedelic sets you at the beginning of the path, and then people do all kinds of things with it.",
"The party impulse is a very subversive impulse. I mean, you know, a lot of artists have too much integrity to sell their art as a brand; but who has so much integrity that they would turn down a party?",
"By manipulating queuing, by manipulating expectation, you can lead people to a fundamental confrontation, not only with themselves, but with the Other.",
It seems to me that it is psyche in a way that has become occluded by the perverse development of language.,
"Certainly neo-Platonism, Plotinus and Porphyry and that school are psychedelic philosophers. Their idea of an ascending hierarchy of more and more rarefied states is a sophisticated presentation of the shamanic cosmology, which is the cosmology that one experientially discovers when they involve themselves with psychedelics.",
"Certainly the central Platonic idea, which is the idea of the ideas, these archetypal forms which stand outside of time is one which is confirmed by the psychedelic experience.",
"History is the in-rushing toward what the Buddhists call the realm of the densely packed, a transformational realm where the opposites are unified.",
"It's a relationship like to a crusty Zen master, or something like that. And it is really like another entity because you cannot predict the answers.",
"No more do we create cultural artifacts that are simply our furniture, but now it's our thoughts, our values, are embodied in this [digital] stuff.",
"At the interface of the say-able and the unsay-able is the novel, the new, the never before seen, said or done. And that's what I think it's important to try and bring out, ideas. Because I think we are the animals that bring back ideas.",
"What good is a theory of how the universe works if it’s a series of tensor equations that, even when understood, come nowhere tangential to experience? The only intellectual or noetic or spiritual path worth following is one that builds on personal experience",
History is the siren song of the soul.,
"The shaman is a very peculiar figure. He is critical to the functioning of the psychological and social life of his community, but in a way he is always peripheral to it. He lives at the edge of the village. He is only called upon in matters of great social crisis. He is feared and respected. And this might be a description of these hallucinogenic substances.",
"The danger is [in using psychedelic drugs], just to put it out there, is madness.",
"Let's not underrate cannabis, for cryin' out loud. Cannabis should be the glue of the community.",
"Life, carefully examined, is actually a form of allegorical literature with a very tight constructural grid laid over it.",
"What is always left out of descriptions of the psychedelic state, the deep psychedelic state, is how weird it is.",
"The whole of the Amazonian narcotic complex, as it's called in the old literature, is based on activation of DMT by one strategy or another.",
"For unknown reasons, there is a tremendous concentration of psychoactive plants on the South American continent. The South American continent has more known hallucinogens than the rest of the planet combined.",
"The western mind, because of it's unique history, is the most sensitive mind to the impact of psychedelics.",
"A great turning point is in the offing. The world is changing. It's changed before, but not for a long time in our lives, not since before our lives. But now it's changing, and there are many many possibilities.",
"It doesn't matter what your cultural conditioning is, it falls into question under the influence of the psychedelic. And for most people that's frightening.",
"My hope is that I may bear witness to the fact that there is a great mystery calling to us all, beckoning across the landscape of our history, promising to realize itself and to give real meaning to what is otherwise only the confusion of our lives and our collective past.",
"The state in the matter of drugs should not, any more than in the matter of sex, act as the secret agent for the agenda of the church.",
I think with the work we do with these drugs we are the earliest pioneers in what over the next 100 years will lead to an understanding of consciousness almost as a thing apart from the monkey body and brain.,
"The traditional manner of taking psilocybin is to take a very healthy dose, in the vicinity of 15 mg. on an empty stomach in total darkness.",
"We have the tools, the intellect, the will to create a caring global culture. It isn't going to come without a recognition of the power of the psychedelic experience. The psychedelic experience is the birth right of every human being on the planet. It is as much a basic part of each and every one of us as our sexuality, our national identity, our consciousness of self. And any society which attempts to hold back or impede this dimension of self-expression, when the history of that society is written, it will be called barbarous.",
I'm not an advocate of drugs. I'm an advocate of psychedelics.,
We are living in a state of constant scientific revolution. There is not a single area that you can name that is now seen as it was seen a hundred years ago. Nothing is left of the world view of one hundred years ago.,
"I have never felt that the primary use of these things was to cure what is called in modern parlance neurosis, what I call unhappiness. It isn't for that.",
"History was an incredibly damaging experience, and now it's over . . . in a sense.",
"Eros is an ego-overwhelming, boundary dissolving, breakthrough creating force scripted into human life that is pretty intrinsically psychedelic.",
I have nothing but scorn for all weird ideas other than my own.,
"Experientially there is only one religion, and it is shamanism and shamanic ecstasy.",
"What we drug people have, that you don't, is repeatability.",
What people notice about [when they are on] LSD is either what's right or wrong with themselves or how freaky the world is.,
"Technique to me is a kind of a ... I'm reluctant to talk about it because it seems so obvious to me what good technique is. I mean, you sit down, you shut up, and you pay attention is basically the good technique. And then the footnotes add; on an empty stomach, in a dark room, feeling comfortable.",
History is just this froth of artifact production that has appeared in the last ten to fifteen thousand years. It spread across the planet very quickly. But that mind in man just goes back and back into the darkness.,
"A glacier rattles in the cupboard, the desert sighs in the bed, and the crack in the teacup opens a door to the land of the dead. The Maya call this Xibalba (Shibalba), the road to the dimension of the dead.",
"We were essentially torn from the Gaian womb, thrust into the birth canal of history, and expelled sometime around the fall of the Roman Empire into the cold hard world of modern science, existentialism and all the rest of it.",
"Because this is the world that science built, with the henchmen of capitalism and Christianity.",
"It's as though a certain level of intoxication with the mushroom is the precondition for being able to communicate, but is not itself enough.",
"So I submit to you that what we represent is a Fifth Column, a Fifth Column that represents the best aspirations that human community is capable of, a Fifth Column that is willing to look at the structure of the psyche in contrast to the mess of society, and willing to dream.",
"We love to congratulate ourselves on the forward-leaning liberal society that we live in, and the truth is it's a bunch of rattle snake-handling fundamentalists that are much closer to Stalin than they are to FDR or anybody else like that.",
"In the way that the 15th Century discovered the New World, the 20th Century discovered the parallel continuum.",
When we really understand time travel we may find out it's as common as dirt and has been going on all around us is all kinds of physical processes.,
"The race isn't to the swift, it's to the thoughtful.",
I can't think of a society on Earth where people don't take drugs that any of us would want anything to do with.,
Nature is actually the goal at the end of history.,
"This is the key. If you get into deep water with these substances, this is true of psilocybin as well, you don't want to clench, you don't want to assume the fetal position and stop breathing. You want to sit up straight and breathe, and sing, and sing it back, and it will step back. You can take control of your situation ... most of the time.",
"You can stand back and look at this planet and see that we have the money, the power, the medical understanding, the scientific know-how, the love, and the community to produce a kind of human paradise.",
"At still higher doses psilocybin triggers this activity in the language-forming capacity of the brain that manifests as song and vision. Psilocybin may have synergized the emergence of higher forms of psychic organization out of primitive protohuman animals. It can be seen as a kind of evolutionary enzyme, or evolutionary catalyst.",
"Inform yourself, inform your children, talk to your friends! And let's try to make a better, stonier world than the one we inherited!",
"The psychedelic species of visual beauty is something we don't see in our furniture styles and our architecture. It seems to be coming in, literally, from another dimension, and yet it is undeniably moving. It's beautiful.",
"Clearly, what is happening, I think, is there is a kind of global emergence of a new mental order.",
That's what a god is. Somebody who knows more than you do about whatever you're dealing with.,
"The data stream has been corrupted, return to first principles.",
The social consequence of the psychedelic experience is clear thinking -which trickles down as clear speech. Empowered speech.,
One of the things that people don't do enough of when they do psychedelic work is spend time in the library.,
"In other words, all these things you might cling to, Catholicism, democratic ideals, Hasidism, Marxism, Freudianism, all of these things are exposed [through use of psychedelics] as simply quaint cultural artifacts, painted masks and rattles assembled by people of good intent but clearly not great grasp of the situation.",
"There will be difficult moments in a five-gram trip, but on the other hand certain questions will be solved forever for you, because you will validate the existence of this dimension. You will see what your relationship to it is.",
We are like coral animals in a vast reef of excreted technological material that is wired for solid state data transfer.,
"Where psychedelics comes together with that is that it's going to require a transformation of human language and understanding to stop the momentum of the historical process, to halt nuclear proliferation, germ warfare, infantile 19th century politics, all these things. It cannot be accomplished through a frontal assault upon it by political means.",
What you call man is time.,
Culture is another dimension.,
"I'm proposing on one level that hallucinogens be thought of as almost as social pheromones that regulate the rate at which language develops, and therefore regulate human culture generally.",
It seems to me that right under the surface of human neurological organization is a mode shift of some sort that would make language beholdable.,
"And so, these are the things, the exploration of which, the singing about of which, makes us human beings. The exploration of the universe of the unseen is the business of human beings.",
"It was the fall into history that enslaved us to the labor cycle, to the agricultural cycle. And notice how fiendish it is.",
Transformation of language through psychedelic drugs is a central factor of the evolution of the social matrix of the rest of the century.,
"If the world is made of language, then you can hack it in the sense that you can hack code.",
"Ayahuasca, unlike mushrooms and all these other things is only as good as the person who made it. . . . The ayahuasca is a combinatory drug, and so it brings the human interaction and the lore of it into a much more central position.",
There's something in the Western mind that gets very nervous when you try to talk about the bedrock of ontology.,
Nature and the imagination seem to be the precursors to involvement in the psychedelic experience.,
The Gaian process is more than a process. It is s self-reflecting entelechy of some sort.,
"I'm not trying to sign people up to a creed, I'm much more interested in the people that disagree. These ideas are powerful but this isn't mysticism in the ordinary sense to be protected by mumblings about faith and all that. This is the real thing.",
History is like self-reflection through the medium of language propelling itself into self-recognition.,
"I'm meeting my obligations, somehow, always have, without ever truly working, without ever putting my shoulder to the wheel for the man. Of course I had to deal dope to do this!",
"This is where I think the psychedelics come in because they are anticipations of the future. They seem to channel information that is not strictly governed by the laws of normal causality. So that there really is a prophetic dimension, a glimpse of the potential of the far centuries of the future through these compounds.",
The good news about psychedelics is that they are incredibly democratic. Even the clueless can be swept along if the dose is sufficient.,
Part of what being involved in the psychedelic experience is about is reclaiming your own experience.,
"Ayahuasca is driven by sound, by song, by whistling. And its ability to transform sound, including vocal sound, into the visual spectrum indicates that some kind of information processing membrane or boundary is being overcome by the pharmacology of this stuff. And things normally experienced as acoustically experienced becomes visibly beheld, and it's quite spectacular.",
"An interesting thing about drugs is often, when a new drug is discovered, it takes a long time to figure out how do you do it.",
"What is happening here is we are living past the age, by the millions, living past the age where cultural values make any sense at all.",
I finally realized that this 'place' that I kept bursting into [on a psychedelic experience] was somebody's idea of a playpen.,
"I don't think that mass drug taking is a good idea. But I think that we must have a deputized minority, a shamanic professional class if you will, whose job is to bring ideas out of the deep black water and show them off to the rest of us and perform for our culture some of the cultural functions that shaman perform in pre-literate cultures.",
"It’s pretty simple, the ethical life. It’s just demanding.",
"These things which are made of light and grammar and sound that come chirping and squealing and tumbling toward you. 'Hooray! Welcome! You're here!', and in my case, 'You send so many and you come so rarely!'",
"I mean everybody knows there's something wrong with the world and if you read left wing politicians or deconstructionists or thoughtful historians they will offer thoughtful critiques of our situation. But the question is, you know, the Tolstoyian question; 'What is to be done?'",
"This rising global humanism is, in fact, the rising into consciousness of a tribal god similar to the kind of tribal god that functioned in these pre-Hellenic societies.",
"We are living in a very pivotal time. The time that we inherit from science is a time to humble you, to dwarf you. It tells you that the sun will not fluxuate for another billion years, that species come and go, and, in other words, on a temporal scale you don't matter. And that now doesn't matter. But when you look at the release of energy, the asymptotic speeding up of processes, we tend to be xenophobically oriented toward the human.",
"My normal lectures deal with the psychedelic experience as a generalized and historical phenomenon, but this effort at communication is slightly more personal in that it's an effort to impart [just] one idea that came out of an involvement with psychedelic substances.",
Standing outside the cultural hysteria the trend is fairly clear. It is a trend toward temporal compression and the emergence of ambiguity.,
"Don't diddle the dose. Once you have done your homework, go for it.",
"I think what electronic culture permits is incredible diversity, and what the print-created world demanded and created was tremendous suppression of diversity.",
"The immediate future of man lies in the imagination and in seeking the dimension where the imagination can be expressed. The present cultural crisis on the surface of the planet is caused by the fact that this is not a fitting theater for the exercise of imagination. It wrecks the planet. The planet has its own Eco-systemic dynamics, which are not the dynamics of imagination.",
"Safety is really a concern of mine, and what I've been telling people recently is that until there's animal and human data on a drug it should probably be looked at very carefully.",
You could almost describe psychedelics as enzymes for the activity of the imagination.,
But what I really am interested in is not the end of the world but everything which precedes it.,
"And psychedelics now, as we de-condition ourselves from the post-medieval world, they are present to hand as tools.",
Human history is a Gaian dream.,
I would argue that it's almost better to do heroin than to watch TV. At least when you're doing heroin you're responsible for your own reveries and thought processes. When you're mainlining TV what is it but endless messages to fetishize products?,
"In our own time, through integrative sciences like ecology and animal behavior and psychology we have re-understood what was forgotten during the reduction centuries of modern science. We've re-understood that the world is one thing, and it's a living thing. It's a thing with an intent and a spirit within it, and this is the key concept.",
"Basically, for me the psychedelic experience was the path to revelation. It actually worked on somebody who thought nothing would work.",
"For me, what all these years of psychedelic taking came to was a new model of how reality works, a new model of what the world is.",
"Is there a necessary succession in style, or are these things pure chance?",
I think transcending our cultures is going to be extraordinarily necessary for our survival. I don't think we can carry our cultures through the keyhole of the stretch of the next millennium,
"To me, the most amazing the most amazing transformation in my lifetime is not the revolution of the Sixties but the counter revolution of the Seventies, where they managed to put the cuckoo clock back together again",
"For me, the glory of the human animal is cognitive activity.",
Human populations that do not have contact with the psychedelic tremendum are neurotic because they are male ego dominated.,
"All psychedelic explorers should be aware of the concept of what is called a cognitive hallucination. The is a much more insidious phenomenon. This is, quite simply, an out-and-out delusion.",
"Tribalism is a social form which can exist at any level of technology. It's a complete illusion to associate it with low levels of technology. It is probably, in fact, a form of social organization second only to the family in its ability to endure.",
The human brain is the god of technological innovation.,
I spend as many hours a day as I possibly can smoking cannabis,
Each stage of cosmic development proceeded more quickly than the stage which preceded it.,
"The psychedelic experience is not a journey into the human unconscious, or into the ghost bards of our human civilization. It's a journey into the presence of the Gaian mind.",
"History is anomalous, and there is no way to get used to it.",
If you're truly psychedelic the difference between living and dying is quite immaterial. No pun intended.,
"What foods are, essentially, are idea-neutral drugs.",
"Ultimately, I think, what the psychedelic experience may be is a higher topological manifold of temporality.",
In the absence of good scientific data about the effects of artificial hallucinogens it's good to stick to the natural ones.,
This is how magic is done. By hurling yourself into the abyss and discovering its a feather bed.,
The 'person' is not an interchangeable part. The 'citizen' is. ... The person is harking back to a pre-print model. It's what the hippies were.,
"The human imagination, which is our great glory, has grown so powerful that we can barely unleash it on the surface of the planet.",
"Within the context of the alchemical vocabulary, the psychedelic experience, as brought to us through plants long in the possession of Aboriginal people, appears to be the identical phenomena.",
"The apocalypse is the millennium, and the psychedelics move you into the future.",
"The main thing going on in the 20th century is a dissolving of boundaries, all the boundaries that historical civilization put in place.",
"On these matters of specific fact, like is the mushroom an extraterrestrial and that sort of thing, I haven't the faintest idea. The mushroom itself is such a mercurial, elusive, Zen sort of personality that I never believe a word it says. I simply entertain its notions and try and sort through them, and I found that to be the most enriching approach to it.",
